{
    "schemaVersion":  1,
    "agentVersion":  "1.0.0",
    "collectedAtUtc":  "2026-06-20T11:50:24Z",
    "hostname":  "WS-BUCH-05",
    "domain":  "corp.local",
    "currentUser":  "CORP\\Claudia.Neumann",
    "lastLoggedOnUser":  "CORP\\Claudia.Neumann",
    "chassis":  "Desktop",
    "manufacturer":  "HP",
    "model":  "EliteDesk 800 G6",
    "serialNumber":  "SNBUCH05",
    "bios":  {
                 "version":  "1.12.0",
                 "releaseDate":  "2022-04-12T11:50:24Z"
             },
    "ageYears":  4.2,
    "ageSource":  "bios",
    "cpu":  {
                "name":  "Intel Core i5-10400",
                "cores":  6,
                "logicalProcessors":  12,
                "maxClockMhz":  3200,
                "sockets":  1
            },
    "ram":  {
                "totalGB":  16,
                "slotsUsed":  2,
                "slotsTotal":  4,
                "sticks":  [
                               {
                                   "capacityGB":  8,
                                   "speedMhz":  3200,
                                   "manufacturer":  "Samsung",
                                   "partNumber":  "M471A1K43DB1",
                                   "slot":  "DIMM0"
                               },
                               {
                                   "capacityGB":  8,
                                   "speedMhz":  3200,
                                   "manufacturer":  "Samsung",
                                   "partNumber":  "M471A1K43DB1",
                                   "slot":  "DIMM1"
                               }
                           ]
            },
    "disks":  [
                  {
                      "model":  "Samsung SSD 870",
                      "sizeGB":  512,
                      "mediaType":  "SSD",
                      "busType":  "SATA"
                  }
              ],
    "gpus":  [
                 "Intel UHD Graphics"
             ],
    "os":  {
               "caption":  "Windows 10 Pro",
               "version":  "10.0.19045",
               "build":  "19045",
               "installDateUtc":  "2022-04-26T11:50:24Z",
               "lastBootUtc":  "2026-06-22T11:50:24Z",
               "architecture":  "64-Bit"
           },
    "win11":  {
                  "tpmPresent":  false,
                  "tpmVersion":  "1.2",
                  "secureBoot":  false
              },
    "network":  [
                    {
                        "mac":  "00:1A:2B:3C:4D:5E",
                        "ipv4":  "10.4.10.132"
                    }
                ],
    "collectionErrors":  [

                         ]
}