{
    "schemaVersion":  1,
    "agentVersion":  "1.0.0",
    "collectedAtUtc":  "2026-06-21T11:50:24Z",
    "hostname":  "WS-PERSONAL-03",
    "domain":  "corp.local",
    "currentUser":  "CORP\\Andrea.Schulz",
    "lastLoggedOnUser":  "CORP\\Andrea.Schulz",
    "chassis":  "Desktop",
    "manufacturer":  "HP",
    "model":  "ProDesk 400 G6",
    "serialNumber":  "SNONAL03",
    "bios":  {
                 "version":  "1.12.0",
                 "releaseDate":  "2021-03-06T23:50:24Z"
             },
    "ageYears":  5.3,
    "ageSource":  "bios",
    "cpu":  {
                "name":  "Intel Core i3-10100",
                "cores":  4,
                "logicalProcessors":  8,
                "maxClockMhz":  2400,
                "sockets":  1
            },
    "ram":  {
                "totalGB":  8,
                "slotsUsed":  1,
                "slotsTotal":  2,
                "sticks":  [
                               {
                                   "capacityGB":  8,
                                   "speedMhz":  3200,
                                   "manufacturer":  "Samsung",
                                   "partNumber":  "M471A1K43DB1",
                                   "slot":  "DIMM0"
                               }
                           ]
            },
    "disks":  [
                  {
                      "model":  "Seagate Barracuda",
                      "sizeGB":  500,
                      "mediaType":  "HDD",
                      "busType":  "SATA"
                  }
              ],
    "gpus":  [
                 "Intel UHD Graphics"
             ],
    "os":  {
               "caption":  "Windows 10 Pro",
               "version":  "10.0.19045",
               "build":  "19045",
               "installDateUtc":  "2021-03-20T23:50:24Z",
               "lastBootUtc":  "2026-06-22T11:50:24Z",
               "architecture":  "64-Bit"
           },
    "win11":  {
                  "tpmPresent":  false,
                  "tpmVersion":  "1.2",
                  "secureBoot":  false
              },
    "network":  [
                    {
                        "mac":  "00:1A:2B:3C:4D:5E",
                        "ipv4":  "10.4.10.21"
                    }
                ],
    "collectionErrors":  [

                         ]
}